"title","upvotes"
"I am stuck in my career. Where do I go from here?",14
"Can social impact programs amplify employee voice and create a positive DEI environment in the workplace? A webinar got me thinking.",4
"I/O vs Business Psychology",9
"Lack of psychological safety",7
"Should one attain a BS or BA degree in undergrad when the goal is to pursue a graduate degree in I/O Psych? Or does it not matter?",7
"EI/EQ Training Resources",2
"What are you working on? - August 2022",4
"Managing People Help",18
"BS Psych Major in undergrad. Is Minor in Neuroscience going to be useful?",11
"Do you do Org Development / Org Effectiveness Work?",23
"Do you think it makes sense to have everyone employee do a public self-assesment at the end of a project and/or an others-assesment?",1
"RStudio is rebranding to Posit in an effort to expand beyond the R community",21
"PhD advisors with emphasis on personality/intelligence?",4
"Is IO still worth it if I dont want to live in big cities? Hows the job market looking due to current lay off in big companies?",5
"Age, salary, years of experience and job satisfaction/work life balance? How many hours do you work per week? Whats your position?",48
"Bi-Weekly /r/IOpsychology Discussion - What have you been reading, and what do you think of it?",6
"Break before Grad school",13
"Looking for recent (or must read) articles on the IAT",2
"Difference between Job rotation, Job enlargement, and Job enrichment",10
"Democracy in the Workplace",8
"Frameworks/models for ""good job"" other than Job Characteristics Model?",13
"Looking for measures of applicants' acceptance of test batteries",3
"Are the cognitive skills of ""deductive and inductive reasoning"" considered ""pattern recognition""? Or, are they separate from ""pattern recognition""?",13
"Certain practices more/less effective depending on cultural context?",7
"Potential jobs with an MSc IOBP degree in the UK?",4
"Masters Thesis - Artificial Intelligence based scenarios",2
"U.S. Department of Justice opens probe into Maryland State Police over possible racial discrimination in hiring and promotions",18
"Excel course for People analytics role starting out?",11
"Are there studies on work speak/the common lying that goes on?",22
"Undergrad job search",16
"Followup question on ADKAR question from earlier this week- Commenters mentioned using ADKAR with Kotter or Lewin's theories. That makes sense, but in your opinion, do clients or hiring employers care about other methods when ADKAR/Prosci is repeated everywhere as THE CERTIFICATION?",7
"Early IO experience",7
"Does Your School Conduct Research on Teams?",6
"Books about management",2
"Asking for a raise / post graduation",4
"is the adkar model of change just a product? or is it",11
"Bi-Weekly /r/IOpsychology Discussion - What have you been reading, and what do you think of it?",3
"If my dream is to teach psychology at the university level, should I get a PhD in IO?",5
"How binding is a PhD in IO Psychology? Could you still teach other topics within psychology? Could you open a clinical practice?",6
"I-O Psychology jobs",12
"Scope for IO Psychology in UK?",4
"Recent college graduate",4
"Where do you find surveys to use?",13
"Research funding in Management Departments",1
"If you could do it all over... Would you still choose IO?",20
"I/O career down the drain",23
"Meet up at AOM",2
"Looking for citations for recruiting method",5
"Prioritizing people ops",9
"Factors that influence the type of occupation a person gets into",7
"Community Funds applications are open!",1
"IO psyc job prospects in Canada (Quebec and Ontario?)",7
"Literature on phrasing open-ended questions / interview-questions",0
"Job title?",20
"What are you working on? - July 2022",2
"Jobs I/O Related (Post-grad)",9
"Pre I-O Jobs",16
"Expectations vs Reality?",24
"Questionnaire For Org About Internal Candidates Perceived Potential to be CEO ?",3
"How useful is data science in I/O Psychology?",3
"I-O Psychology Academic Tree",20
"Bi-Weekly /r/IOpsychology Discussion - What have you been reading, and what do you think of it?",6
"Is marketing part of my job??",11
"Best material to learn about performance appraisal/management?",8
"How do I/Os help both management AND employees at the same time?",3
"IO certification options",12
"I/O as a Career? Thoughts? Losing an organ derailed me",1
"Breaking into I/O Psychology with a BA in Psychology",26
"Performance management",3
"What do you all think about mediation analyses on cross-sectional data?",9
"Hi. I reviewed the rules and think this acceptable here: Completed MA I/O Psych and seeking advice for part-time consulting employment",8
"Career paths with IO psych?",18
"When and why does status threat at work bring out the best and the worst in us? A temporal social comparison theory (Organizational Psychology Review, 2022)",4
"Workplace politics: how to make an executive committee comprised of ambitious, political, and competitive people work.",13
"Digital Nomads",22
"Assessment methods for skills",1
"Get a second bachelors degree?",6
"IO Psych Student - Tell me what I should know!",5
"What is the most frequent type of analysis you conduct at work?",3
"Wage gap&",27
"Hello, an Indian candidate here. Are there any Indian online reviews or journals equivalent to HBR and the likes?",1
"What other courses would you go for?",3
"What are current trends, buzzwords and concepts in the applied setting?",5
"how does the industry of I/O Psych treat tattoos and piercings?",3
"project need responses",1
"Reasoning score anology",1
"Employee Referral Programs",10
"Have you ever done a post-exit interviews?",4
"Is IO Psychology for me?",10
"OCCUPATIONAL HEALTH TOPIC + CAREER PATH",4
"Literature Search/Sources",3
"What are the best books about Machine Learning driven organizations?",9
"Book recommendations for getting into change consulting practice",8
"How do you define belongingness?",11
"There is the saying that you cant improve what you dont measure. So how do you quantify employee performance?",8
"Is it always true, that you shouldn't give people bonuses based on performance, because extrinsic motivation kills intrinsic motivation? What about job titles or other reputation symbols as rewards?",19
"MBTI vs Enneagram",0
"What of note has been going on recently in business consulting and change management?",6
"Data driven organizations",45
"Leadership Development Benchmarking",4
"The linkage between cognitive diversity and team innovation: Exploring the roles of team humor styles and team emotional intelligence via the conservation of resources theory",4
"Bi-Weekly /r/IOpsychology Discussion - What have you been reading, and what do you think of it?",2
"Counter argument",6
"Employee Assistance Programs - How can we improve them?",1
"Why Warmth Is the Underappreciated Skill Leaders Need",2
"Are there any free/affordable online learning resources for IO?",15
"Personality assessment tools used while recruiting",3
"Need advice on purchasing a index for use in a study",2
"A Brigham Young University study of 80 newly formed teams found that groups that played video games together for just 45 minutes were 20 percent more productive than those that engaged in more traditional team-building exercises.",69
"A Massive LinkedIn Study Reveals Who Actually Helps You Get That Job - Acquaintances, more than close friends, show the strength of weak ties when it comes to employment",53
"I/O psychology mentor - Talent management",7
"Been having trouble finding a job right after getting my Masters",22
"Predictive Index?",8
"What do you think about having two teams in your company with exactly the same tasks, and having them be rivals to each other?",9
"Am I low-balling myself?",17
"What can we learn from recruitment?",9
"Courses to supplement unrelated bachelors",2
"The war for talent - is it still a thing in 2022/2023?",6
"Not sure how to continue learning I/O psych during undergrad",2
"E-leadership prevalence in post-pandemic workplace, thoughts?",5
"People who got their masters in IO with a BA in psych: What was your minor?",18
"Does anyone know of any books (academic or other) that do a good job highlighting the engagement research that has been and is coming out of social media?",3
"Virtual interview nightmares",2
"Hi everyone, is anyone familiar with a predictive framework that uses customer a type of psychological profile of a customer to predict how a customer/client will value your business?",7
"Scales of measurement",7
"What do you think are the challenges that I/O psychologists are currently facing?",22
"Is IO Psych inherently anti-labor? Why or why not?",30
"Do you think it makes more sense to study combinations of Big 5 traits rather than individual traits?",1
"Social Platform for Organizational Scholars Interested in Disability-Related Topics",2
"Research has found that you are more convincing when you phrase your opinions in form of a story rather than just stating facts or referencing scientific papers. How can I learn to communicate more in stories?",13
"Literature review topic on disabilities",7
"I have an interview as a Talent Assessment Consultant and was hoping for some pointers.",26
"Is it normal to have large differences between subtraits?",0
"Mentioning company names in personal statement for Masters?",5
"Does someone with a more competitive personality or a more cooperative personality have more success when leading a business, when all other traits are equal?",2
"What are the most common I-side applied roles?",10
"Survey platform for independent contractor use?",8
"Any resources for tree models in psychometrics?",3
"Bi-Weekly /r/IOpsychology Discussion - What have you been reading, and what do you think of it?",4
"What are some survey question's to check whether employees are in the right place and are doing the right and most efficient work?",5
"Do I/O Master's programs typically require you to be employed to do certain assignments/projects?",9
"Best Journals in the Field",19
"Research paper topic ideas",12
"Well, that's discouraging.",62
"What keywords can I use to look for entry-level jobs in psychoanalytics",19
"Recently laid off and looking for community help",21
"Looking for research on retirement",7
"What is the latest in IO Psych? How do you keep yourself up to date with the latest research and news?",29
"What are you working on? - September 2022",4
"Consulting billing?",34
"Study Design - Retrospective Standardized Testing and Employment Outcomes",4
"What's your vision/strategy and outcomes of learning &amp; development in your company?",2
"Link between DEI/wellbeing and Recruitment?",1
"Interested in I/O",8
"Interested in I/O. Coming from sales. Long shot? Need advice.",19
"What are good primers on industrial/organizational Psychology?",9
"Advice for the statistical portion of I/O Psych",14
"looking for a job.",9
"Just a quick question from some considering going into I/O psychology",6
"Are we ever going to be able to change this?",34
"What's your personal shortlist of companies that you'd like to work for? What makes them interesting to you?",22
"Currently in undergrad, I need answers about I-O.",6
"Racial barriers to MSP world.",2
"Assessment Strategy",5
"Python and R courses online",21
"Bi-Weekly /r/IOpsychology Discussion - What have you been reading, and what do you think of it?",5
"Textbook help",9
"Looking for advice on how to organize L&amp;D in tech product company",7
"Has anyone ever worked for a company where they actually did job analyses? (During or before you practiced I/O)",16
"Looking for research on differences in requirements (KSAOs) by job clusters / job families",3
"Difficulty of Master's Program?",8
"what do IO psychologist do?",7
"Companies that pay for your program",2
"Working from Home",18
"MS in IO? Need Advice",8
"Tips to get into People Analytics role",19
"Who are the leading academics/practitioners in the field that study/develop unobtrusive measures?",4
"The Rise of the Worker Productivity Score - automated worker tracking for the purposes of performance management",31
"I/O Intern asking for advice and guidance!",7
"IO psychology to the rescue!",48
"For those in the IOP field - students, professionals, professors, etc",1
"Gift ideas for an IO Psychologist?",11
"I-O to business analyst career path?",21
"Is an I/O background useful for project management?",20
"Pay Transparency Strategy",11
"the logistical issue for completing a competency model across 50 job families with unique behaviors for each career level (20 total).",15
"Bi-Weekly /r/IOpsychology Discussion - What have you been reading, and what do you think of it?",2
"competency model developed with company values",7
"Any tips on taking the SHRM certification?",9
"PhD and working full time? Good or bad idea? Hi Im considering doing both, hopefully trying to match both (ie research topic being relevant to the org and myself). Have people done it? The potential PhD supervisor seems okay in terms of time expectations on the work.",6
"are you content with your io degree?",31
"Job opportunities",2
"cut-off scores",2
"Best book on qualitative research method",12
"Idea for a bachelor thesis",1
"German IO Job names",8
"Under new WHS laws, Australian employers will have an active duty to protect workers from psychological injury",26
"Curious if anyone would be willing to share how they structure their select assessments function in their company",6
"Questions about the field from an undergrad",3
"Second-year Canadian university student with questions about research and career paths.",4
"What job analysis methodology do you recommend? I want to strengthen a selection process for a high risk role but want to look deeper into the reality of the role. Any references welcome.",9
"I/O psychology vs Buisness analyst",9
"Help, please recommend short courses or books one can refer to up-skill themselves in the field of IOBP?",3
"Hello, how can a fresh graduate go about finding jobs in this field in London/UK market?",3
"graduating in the spring w/ masters degree; when do I start applying, where are the best cities for IO psychs?",12
"How much do I have to like the I side to realistically enjoy working in IO? Am I considering IO for the right reasons?",22
"Finally, some me time: A new theoretical perspective on the benefits of commuting",9
"Are there companies which most IO Psychologists strive to work in?",21
"What are you working on? - November 2022",8
"Bi-Weekly /r/IOpsychology Discussion - What have you been reading, and what do you think of it?",1
"U.S. Supreme court heard arguments for and against use of any racial criteria in university admission policies. Has race based affirmative action served its purpose and diversity does not require a consideration of race at any level of admission and thus be eliminated?",11
"Interesting, startup meets corporate",33
"Psych Major wanting to get into hr [resume question]",11
"Free virtual conference for undergraduate students interested in obtaining a PhD in I/O, hosted by SIOP on Nov. 7th and 8th. Save the date!",24
"Seeking employment in mid-career.",13
"MS thesis on POPs and Knowledge Hiding in Higher ed Faculty",1
"Ever Thought About Strikes? Development of a Scale to Assess Attitudes and Behavioral Reactions to Strikes",7
"IO Psychology Articles that Everyone Should Read",44
"Organizational Behavior vs I-O Psychology differences",6
"OD Consultants: how do you put your experience on your resume?",11
"Qualitative network analysis?",4
"Beginner Resources for Network Psychometrics?",4
"Prepping for Masters in IO Psychology",6
"Recommendations?: Where to start an I/O Psych career?",7
"Is this a good job offer?",15
"How hard is it to learn Tableau?",4
"[OC] I/O Psychology Salary Before and After Adjustment for Cost Of Living by State",59
"Company plans on sending out surveys for ""pulse checks"" a few times a year. To keep it to a practical amount of questions (I'm guessing 5-10) that provide actionable data, what constructs/questions would be be best to include in the survey?",13
"Interview request - job shadow",10
"I/O &amp; Performance Psych",9
"burnout studies in organizations",3
"Amazons attrition costs $8 billion annually according to leaked documents. And it gets worse.",39
"Bi-Weekly /r/IOpsychology Discussion - What have you been reading, and what do you think of it?",5
"Example of Job Analyses?",2
"Reliability and validity",13
"Do I/O Psych PhD programs suck your lifeblood?",24
"Certificate in IO Psych vs. MA in IO Psych",7
"Licensing",4
"Engineering to IOP",2
"Experience using RevMan, Covidence or other software for a meta-analysis",6
"Is it better to send corporate survey before Christmas or after New Year's?",7
"IO psychology masters personal statement",14
"Currently a clinical Psych RA, contemplating shifting to an I/O career&what relevant experience do I need to apply to programs?",15
"Consumer behaviour",1
"Trying to get HR internship here with no experience. HELP!",17
"psych studies published in non-psych journals",1
"my predictive index results",6
"Working in a corporation? career?",4
"What burns you out in this field?",31
"Who are some of the biggest unconventional team / leadership development consulting firms?",12
"Bi-Weekly /r/IOpsychology Discussion - What have you been reading, and what do you think of it?",3
"Team exercises?",10
"SIOP Conference too expensive?",13
"What/why do proposals get rejected from SIOP Annual Conference? What typically gets accepted?",5
"If someone said ""the way we work has not changed much since the industrial era"" what kind of data or proof would you identify to reinforce that?",3
"What is the impact of forcing employees to commute back to work after working from home?",67
"How do you define personality?",3
"Trying to find access to an article",8
"IO resume question",4
"What are you working on? - October 2022",3
"Would appreciate advice.",2
"What is the highest paying jobs in IO Psychology?",23
"Strategies on organizing citations",3
"Looking for participants for my graduate capstone project",2
"Masters in IO but no prior experience",1
"Practitioner Conferences?",7
"Undergrad looking for internships, is HR my only realistic internship?",14
"""Orderliness is associated with slightly lower achievement."" Is this accurate?",0
"Is the personality trait ""Achievement-Striving"" the same as being ""Status-Seeking"" or are these different concepts?",1
"Prominent Italians in I/O?",1
"How to Generate data from rasch model in R ?",1
"The presentation(s) I most hope to see at SIOP23...",3
"How often do you encounter BCBAs in this line of work?",1
"As the economy heads into a potential recession, executives seek out consultants and organizational psychologists to reverse the trend.",11
"What are your thoughts and experiences regarding peer appraisal?",4
"The absence of complaints is one of the surest sign of failing leadership",20
"Where to sell old text books?",2
"People with political skill are more likely to end up in leadership positions, but are people with political skill better leaders?",12
"How to foster psychological safety at work?",6
"Interview Request - Job Shadow",6
"Examples of work injustice, CWBs in tv shows, movies?",4
"lmao what are IO psychologists thoughts on Micheal Scott",47
"What Is a Performance Management Cycle?",2
"Case study resources?",6
"How to stop psychopaths and narcissists from winning positions of power?",0
"What do you think about Schein's books Humble Leadership, Humble Inquiry, Humble Consulting and his other books?",1
"How often should you do team events?",1
"Need help with the right approach for measuring employee's motivation (+ does anyone have the MWMS scale scoring?)",6
"Attrition analysis",12
"Bi-Weekly /r/IOpsychology Discussion - What have you been reading, and what do you think of it?",2
"Just for funsies, do you prefer I/O Psychology or I-O Psychology",19
"Getting I/O or business/organizational behavior doctorate degree ?",1
"What can I be doing to improve my skillset during my free time?",14
"How do you pitch your ideas?",4
"People Development",13
"Should I major in psychology at the University of Minnesota or would it be better to go to the business school (Carlson school of management) and go for human resources and industrial relations major?",10
"Soft Social Credit Score",11
"Database of work sample tests?",4
"Time-to-Event Analysis Aversion",11
"Scope for IO Psychology outside the USA ( majorly Australia and India)",1
"Would online Coursera courses fulfill grad school prerequisite?",4
"Low GRE score. What are my chances?",5
"Yay! Pop culture is finally listening to what weve been saying for decades!",105
"We are all playing for the same team right?",14
"Book recommendations?",8
"Has anyone here transitioned from more traditional IO Psych work to UX Research?",28
"Bi-Weekly /r/IOpsychology Discussion - What have you been reading, and what do you think of it?",7
"Work-life Integration - question regarding my degree thesis",8
"How do you get your value proposition in laymans terms? I always hit a wall trying to explain what I do in a compelling manner without boring or confusing people.",16
"did anyone not get SIOP feedback?",2
"SIOP Conference Decisions?",8
"How to remove careless responding from reverse scored survey",7
"Is our field dying? I feel like any Joe Blogs gets roles in fields IO psychs are working in. What do you think?",18
"Survey crowdsourcing",3
"Message to IO Students: Don't let imposter syndrome discourage you",52
"What are some interesting topics you think should be researched nowadays in the IOPsychology field?",21
"What type of internship would you recommend?",13
"How has a Ph.D in IO made a difference in your career compared to your Masters?",30
"Alternatives to MTurk",7
"What global job evaluation methodology do you rate as the most practical and effective?",9
"Introductory books to IO Psychology / Podcast recommendations",17
"Feeling a bit lost.. (CA)",17
"What do you read for fun?",6
"People Analytics / HR data analytics question",21
"Bi-Weekly /r/IOpsychology Discussion - What have you been reading, and what do you think of it?",7
"Statistics/Psychometrics",1
"NEED SOME ADVICE &lt;3",4
"How can I learn to do job analysis (beyond simply re-reading my IO Psych textbook)?",13
"Any recommendations for good certification courses for some with 3-5 years experience?",9
"A New ScienceForWork Article &amp; Audio Episode (See Link)",4
"Need inspiration for ad-hoc data projects",9
"How many people here are consultants without a Mba or a Ph.D. degree?",26
"Research into IO Psych",8
"IO Psych advice for undergrad",9
"Where could I find some I/O firms from South America, and Asia?",10
"Does anyone also have HR certifications?",10
"What are the dream positions or organizations in this field?",4
"What internship would you go for as an undergrad?",9
"How is IO Psychology",11
"Good, Bad, and Ugly Leadership Patterns: Implications for Followers Work-Related and Context-Free Outcomes (Journal of Management, 2021)",11
"Looking for HELP/Suggestions on Personnel Selection",1
"Starting Salary of occupational/ I-O psychologist in UK",4
"Help me design a silly experiment for fun",6
"Employee Experience Management",6
"HR Data Analytics / People Analytics Certifications?",22
"What are you working on? - December 2022",8
"Providing interview questions to applicants prior to the interview.",7
"Recommendations on a measure/scale to get a sense of how people are feeling prior to a big structural change? I intend to run it a few times this year to keep a pulse on things. JAWS, JDI and JIG are options but there may be something more appropriate that Im not aware of?",14
"Bi-Weekly /r/IOpsychology Discussion - What have you been reading, and what do you think of it?",5
"Looking for an I-O Psychologist for a Graduate Paper interview",1
"What factors should I be looking for in a college to be successful in the future for IO Psychology? What does a linear path look like?",18
"Thoughts on the Lumina Spark for Leadership Development",5
"Sometimes I have trouble dilineating where our field ends and business or politics begins.",1
"What are the most valid personality tests for recruitment?",17
"May I please have recommendations for a layperson guide to personality disorders in the workplace, preferably from DSM5+?",0
"Any org psychs in MBB consulting?",5
"A leaked Amazon memo may help explain why the tech giant is pushing (read: ""forcing"") out so many recruiters. Amazon has quietly been developing AI software to screen job applicants.",17
"Realistically, What Are My Grad School Chances?",9
"Walmart shooting raises need for violence prevention at work",37
"The Effects of UPcomplish on Office Workers Sedentary Behaviour, Quality of Life and Psychosocial Determinants: A Stepped-Wedge Design (International Journal of Behavioral Medicine, 2022)",6
"Best way to measure how something affects Job Satisfaction?",5
"20 years experience in corporate leadership training has taught me that 95% of it is a massive waste of money!",62
"Interpretation of Hogan Assessment Results (HPI, HDS)",2
"Most Recent SIOP Income and Employment Survey",39
"Is there any scientific proof that personality and cognitive tests work for recruitment?",24
"Marrying 20 years in tech to IO",13
"Please Share Your Newly Published Articles",2
"What kind of person goes into IO?",43
"Any research on what factors affect the validity of assessment methods?",7
"What made you decide I/O",17
"I/O topics with small moral components?",2
"Looking for a website that had almost all the papers for surveys",1
"Hi, does anyone know whether the recovery experiences scale is free to use for research purposes? Does it require permission from the authors?",5
"Is there any way to view poster information from SIOP 2022 online?",1
"what does a day in the life as an io psychologist look like?",15
