"title","upvotes"
"Who is working on The Great Resignation?",15
"Career Pathway in IO Psych",15
"What is the consensus in the I/O community about Erin Meyer's The Culture Map?",1
"What are some of your favourite literature/systematic reviews within IO Psychology?",11
"Best Part of Being an Industrial Organizational Psychologist",11
"Here is my idea for my masters thesis, I would love any feedback on relevant literature, tips for connecting these constructs, etc.",7
"Any strategic/operational workforce planning people in here?",8
"Editorial strategies on HR trends driving evolutionary change across the global workforce landscape. Presents a great opportunity for investigative research and development of new data sources from diverse audiences.",2
"Does anyone know of any free IO psychology courses that are of good quality online? (Coursera, YouTube, etc.)",5
"Where do I start?",4
"what career have you done w/ your IO.P degree?",14
"How are people chosen to review for journal articles?",8
"New York City to Restrict Use of Automated Employment Decision Tools",27
"Common Federal Government Job Titles for I-O Psychologists",104
"What are some topics/concepts within I/O that could do with a systematic literature review?",6
"IO Consultants/freelancers - how flexible can you be with time off?",3
"What is your Industrial-Organizational Psychology (IOP) elevator pitch?",11
"Hey people! Aspiring IO psychologist here! Can you please share your latest topics of interest? Im reading about them and want to expand my knowledge. TIA",8
"Level of Programming Done in This Field",12
"Io Internship",2
"A former Amazon drone engineer who quit over the company's opaque employee ranking system is working with lawmakers to crack it open",17
"Plans for SIOP 2022 - Poll",6
"Bi-Weekly /r/IOpsychology Discussion - What have you been reading, and what do you think of it?",3
"Even for people analytics is the most sensible Bachelors program Psychology?",14
"Interview",14
"Any tips for a recent I/O psychology graduate?",9
"Way to go, Belgium: Right to disconnect: boss may no longer call employees after hours",34
"Gary Bolles, expert in how organizations change and evolve, says that leaders need to grapple with the post-pandemic expectations employees have for their jobs.",6
"Needs analysis methodology and/or model",1
"IO in Asia?",9
"Python for Analytics and Assessment",11
"Making meaningful comparisons between test scores",7
"Help with Graduate Apps Personal Statement and Writing Sample",8
"Pursuing PhD in I/O prior to Career Change",6
"Why is Cohen's d superior to the t-statistic as a measure of effect size?",10
"Advice on pursuing academic IO Psych research as a hobby interest vs. career",10
"IOP &amp; flexibility",3
"What's the pay like for IO Psychologists in the UK?",9
"Examples of IO Psychology cover letters?",7
"Computer Programming and IOP",2
"Coursera Certificate",10
"Anyone have experience completing their Master's and then going on to complete their Doctorate's?",4
"What are you working on? - January 2022",2
"What's the best way for me to get into this field?",15
"Should I apply for a Direct Home Care Internship as a psych junior?",1
"Looking for resources on the topic of stress in the workplace",4
"I/Os - Help me get unstuck and define or explain this? Something like advanced, backward compatible, higher-order, meta-competencies and KSAs. Complex problem solving through active gathering, integration, and application of knowledge. I can't boil this down to what I want to say.",0
"What are the best psychology books?",5
"Understanding Construct Overlap",3
"I/O Psych with a focus on Healthcare?",13
"IO psychologist leadership assessment question",4
"Bi-Weekly /r/IOpsychology Discussion - What have you been reading, and what do you think of it?",4
"Women are more likely to feel too cold at the office and more likely to report that the office temperature is impacting their performance at work.",30
"What is the average salary earned in I-O Psychology For new starters with a PhD",3
"Advice for undergraduate Bachelor Psychology student",7
"Virtual world conquest as a stealth assessment of real skills: Business school students who are good players of Civilization V also turn out to be better planners, organizers, and problem-solvers, in small proof-of-concept experiment. Strategy games may be used for covert, holistic assessments.",26
"Good organizational culture resources",7
"Has anyone made the transition from UX (Research) to I/O Psych?",1
"Is my understanding of IO Psych way off? Interested in motivation and management styles.",16
"Which questionnaire is the best for measuring work motivation?",8
"If I did my masters In UK for io psychology, can I work in USA?",4
"A Conceptual Framework of How Meeting Mindsets Shape and Are Shaped by LeaderFollower Interactions in Meetings",8
"Observational Learning in Movies",1
"Do you feel like you actually learned everything you needed from your IO masters program?",19
"Thinking about entering the field",12
"Do consulting firms really place that much value on new hires coming from target schools?",15
"How did you choose your specialization?",15
"Communicate technical results to non-technical audience",2
"Building creativity and listening skills",5
"Need some help from you guys",0
"Thinking of entering the field from a different area of psych",2
"Bi-Weekly /r/IOpsychology Discussion - What have you been reading, and what do you think of it?",5
"Difference between IO psychologist and People with Business Degrees?",25
"DAOs: a novel human organization",11
"Using statistics to target groups within a company",5
"Is there research on the claim that merely believing a job interviewer likes us may increase our chances of being hired?",3
"How many of you in IO psych work remote?",19
"My take on different subfields of I/O as a practitioner 6 years post-PhD experience",48
"Podcast Interview with Ken Lahti: Can Artificial Intelligence Detect Charisma?",11
"Factor Analysis / Dimension Reduction in multi-rater survey data?",12
"Career Path for Getting Into IO Psych With Little Relevant Experience",10
"Does it pay?",3
"What research you would do if you had infinite resources?",15
"Stats question about Multilevel Path Analysis",4
"Psychological testing for Firefighters",20
"IOs that aren't in strictly ""IO Psychology"" roles (like HR Generalist, Talent Acquisition, etc), how do you bring your knowledge of psychology to your role? I'd love some examples!",37
"Looking for academia to industry perspectives and experiences",15
"What are your thoughts on personality tests' value as a selection tool, whether it be as a hurdle used to screen candidates out of consideration in the hiring process, or used in conjunction with other tools (e.g., work samples, interviews) to help inform final hiring decisions?",18
"Skills-Based Hiring",7
"So....who's heading to the SIOP Seattle conference in April?",19
"What jobs would allow me to conduct research in organizations with only a Master's in IO",11
"Advice deciding between REU's",3
"High5Test.com Support is the worst",0
"Considering a change from Social Work to I/O Psych.",10
"Seeking a brief virtual chat with an I/O professional.",12
"Bi-Weekly /r/IOpsychology Discussion - What have you been reading, and what do you think of it?",3
"Part-time consulting work?",15
"Keep up with research?",10
"I made a Boolean string for your next job search!",113
"Conferences?",2
"Over half of the hiring managers I deal with",41
"Employee engagement &amp; integration in a new normal",9
"A Novel Approach to Debriefing Medical Simulations: The Six Thinking Hats",2
"Is the SIOP Career Center Worth the $$$?",6
"Leader Transition Process",6
"Looking for Resources and any Thoughts on using Sampling Weights in statistical analyses",5
"What are you working on? - March 2022",7
"User-generated questions for employee experience surveys?",8
"What do IO psychologists really do?",19
"Psychometrics Certification",3
"Where to get an I/O Psychology License",0
"I'm looking for a Big 5 personality test that used either paired comparisons, forced-choice, or rank order techniques instead of the rating scale. Anyone here know of any?",4
"Any advice for this newly admitted ph.d student?",13
"Baseline assessment question",7
"Is a Communication Studies BA helpful at all for an IO masters degree?",2
"Toronto or Montreal for IO jobs?",1
"The Public's Perception of those Diagnosed with Mental Health Disorders and their Ability to Reliably Testify in Court",1
"Motives and preference",7
"Trends in Organizational Attachment",5
"Bi-Weekly /r/IOpsychology Discussion - What have you been reading, and what do you think of it?",10
"Research trends in work-non work balance .",4
"Research/Internships for Undergrads?",11
"Reasons NOT to become an I/O Psychologist?",28
"Effects of negative behavior or personality focused feedback at the workplace",12
"Best pre-employment screening for testing cognition/personality? Preferably one that is free or reasonably priced.",1
"How was finding a job for people who have experience in the I/O field?",19
"How to screen potential employees for conscientiousness without them realizing they're being tested and just putting the answers that the employer is looking for?",7
"The Epidemic of Mental Disorders in BusinessHow Depression, Anxiety, and Stress Spread across Organizations through Employee Mobility",17
"Intern jobs at PhD levels",2
"Michael Kraus drama",19
"Request for Resources on Applicant Selection Using Statistical Software",13
"Intern Coordinator relevant applied experience?",6
"Balancing practice with academia",10
"IOs working remotely?",2
"Interesting articles on video-on meetings?",7
"What do you wish you knew before your career in I/O psych?",38
"Request: Interview with an OD specialist",4
"Available eBook : Recruitment and selection in Canada 7th edition",13
"Current status of the I/O psychologist in Australia?",4
"In your (subjective or objective) opinion, what are the strengths and weaknesses of OB vs. IO training for academia?",7
"21st Century Skills Assessments",1
"I/O Syllabus",16
"Where to start?..",7
"Bi-Weekly /r/IOpsychology Discussion - What have you been reading, and what do you think of it?",3
"Hourly rate advice",6
"Creating detailed job duties and tasks lists for a dozen positions",8
"Organizational loyalty scale?",6
"Tattoos as an IO",13
"Tips on focusing on the Organizational aspect in a career with I/O Psychology?",1
"Where are we on leadership development?",9
"Should employees know that you are modeling them?",12
"Recent Psychological tools (2011-2021)",4
"Scientist practitioner too technical for the applied world?",15
"I/O related internships? (undergrad)",10
"Agree or disagree: Never work harder than the client themselves",14
"What are some companies I should check out for internships?",13
"What analyses you run at work?",12
"With IO Psyc drawing on work from multiple disciplines, how do researchers within IO psyc develop a solid grasp of material?",6
"Assessment Tool Certification",7
"How to Explain I-O to Someone Who's Never Heard of it?",24
"What are you working on? - February 2022",11
"What is the process to become an IO lecturer?",6
"IOpsychs who work with software developers - what are some methods you use to train and upskill them?",9
"I/O psychology and promoting sustainability in organizations",5
"Tips for interventions regarding psychological safety and innovation",12
"3 years into IO career. What I should know by now?",37
"Help on Analyzing Employee Engagement Survey and Test Type",13
"Organizational Development learning resources?",5
"Looking for Full-Time Learning &amp; Development Coordinator/DEI Specialist for a National Healthcare Company (Remote-US)",9
"Podcasts/shows related to HR/I-O psych?",23
"Gap year job search while still applying for I/O Grad schools in the fall + mental health rut",8
"Redditor describes what its like to work at a bloated dysfunctional organization (Unilever)",17
"Workplace Safety",3
"IO psychology vs. HR",9
"Bi-Weekly /r/IOpsychology Discussion - What have you been reading, and what do you think of it?",2
"IO Psychologists who hate statistics, which resources helped you the most?",22
"Practitioners, how and how often do you keep up with academic research in your field?",13
"How are job prospects outside the US (e.g., Dublin, Ireland)?",11
"What made you decide on I/O instead of clinical pyschology?",2
"What is the academic job market like for organizational behavior business PhDs?",9
"Reminder: Questions regarding graduate school posted outside of the stickied grad school thread will be deleted.",13
"IO Psych officially recognized as STEM (US)",179
"Im an HR consultant at a big investment bank&ask me anything!",15
"Got into my dream masters program for I/O psych :):)",58
"Best minor for me?",2
"The comments in this thread are so misinformed. As a discipline, how can we do better at demonstrating that pre-hire assessments are valid [not pseudoscience]?",17
"Am I getting paid enough? I recently defended my dissertation after 8 years grad school experience, I was abd for 2 years (thanks COVID), and have been at my company full time for 1.5 years. Im also required to come into the office full time and live in San Diego. I make 103k base salary&",15
"what were your graduate school classes like?",9
"Do I stand a chance?",19
"Will studying IO be useful for HR? What research can I do in the field of IO to show my interest in HR?",19
"Entering IO Psych. profession with a Social Psych. graduate degree",5
"A question about Herzbergs two-factor theory",5
"Question: can an undergrad IO degree be used in a sports organization?",6
"How do you apply machine learning techniques to IO concepts?",15
"Humanitarian Work Psychology",12
"Career advice needed please",11
"Hello everyone! I did a psychometric test for a company. I googled it but can't find it. I had to draw straight lines (of a character size) and as many as possible during 1min intervals by 5min. Does anyone know what the test is called or what it is for? I attach an example.",22
"Jobs in I/O",22
"Scales for Role Ambiguity/Conflict?",1
"Looking for studies comparing remote versus office workers' performance. Specifically, something about bias, heuristics, etc. Any suggestions?",17
"Research",1
"Is it crucial to have a business major background prior to MS in IO Psych?",8
"Looking for highly regarded research on succession planning.",12
"How do you dress for your job and what type of bag do you use?",16
"Have any of you done freelancing or used Upwork?",11
"How often is social network analysis methods used in IO?",10
"Organizational Development Careers/Career Path",4
"SIOP Conference First-timer",6
"Research on Personnel Selection",5
"Most Respected/Top IO Psych Programs?",25
"AlixPartners Assessments",3
"Building an inclusion network",7
"Intern experience",8
"Asking for a raise/promotion",17
"Career Advice",3
"Anyone Else Having Latency Issues with SIOP Webpage?",7
"HELP! Looking to interview an IO Psychologist",8
"Good book to start?",2
"How much writing do you do as an IO psychologist?",10
"what is the difference between Industrial and Organizational Psychology?",4
"Wharton is hosting a HR data case competition for students. The winner receives $10K USD - check it out!",24
"Undergrad Internships",2
"career advice.",0
"Undergraduate student going into a IO masters.",4
"Starting a job at a startup where I will be building their HR/People Function from scratch. Which books/research papers should I read?",39
"assessment instrument ideas?",3
"The official IO psychology discord!",25
"Is there any evidence that psychology graduates are better fakers in personality measures than graduates from other majors? Any thought would be helpful",3
"SIOP Question",3
"Should I do a master's right after my bachelor degree or get work experience first?",8
"Job Opportunity - People, Science, and Strategy Manager, San Francisco Public Utilities Commission",2
"Do IO Psychology consulting firms need a PHD?",12
"Where should I study?",3
"How common is it for I/O psychologists to work with Labor Unions?",26
"how will my clinical research experience in psychology be useful for IO psych field?",8
"Testing for employee selection",12
"nyc area",1
"whats the best field in i/o for introverts?",16
"Bi-Weekly /r/IOpsychology Discussion - What have you been reading, and what do you think of it?",1
"General Advice Needed",11
"How did you structure your CV when applying for research roles in industry?",6
"Does anyone have any articles they really liked for the following 2 topics:",6
"Double major in Psychology and Business Analytics?",16
"How can I specialize in a field that combines I-O psychology but also uses clinical psychology?",14
"IO psychology for r/place",6
"What is a typical day at work for you I/O psychologists?",34
"2022 Grad School Q&amp;A Mega-Thread",24
"Employee Engagement Surveys&w no demographics?",7
"What are you working on? - April 2022",13
"Research into human flourishing?",7
"Recommendations on theoretical frameworks",8
"SIOP Salary Survey open through April 10!",42
"Publicly available I/O datasets for an SEM analysis?",2
"Interactive report on burnout at work  2 in 5 workers at high risk of burning out [upvote if you can]",25
"Would anyone in this field be willing to talk to me about what a PhD is like and what happens after?",15
"A Conceptual Framework of How Meeting Mindsets Shape and Are Shaped by LeaderFollower Interactions in Meetings",2
"Thoughts on University of Houstons PhD program?",2
"New US News Rankings",12
"Looking for help from I/O R enthusiasts for my upcoming I/O coding Discord community",41
"What are your best tips for a junior applying to a mix of masters and PhD programs next fall?",13
"Thoughts on MS Org Leadership?",5
"UWES Help",6
"HR Project Management as a Career Path",8
"Help Deciding !",2
"Salary as PhD student",9
"Bi-Weekly /r/IOpsychology Discussion - What have you been reading, and what do you think of it?",1
"How to help students understand criterion development?",10
"Paul Spector: A New I/O Faculty Retention Problem",32
"Positive Organizational psychology",12
"IO relevant job market in US vs UK",12
"Thinking About Thinking About Work: A Meta-Analysis of Off-Job Positive and Negative Work-Related Thoughts (Journal of Business and Psychology, 2021)",30
"Career Pathways - Data?",7
"Anyone else finds parameter estimation in psychometrics too tough ?",4
"Need to interview a consultant",10
"Which undergraduate lab experience will boost my IO Ph.D. application?",10
"Graduate Certificate in IO Psychology",15
"Looking for entry-level IO Psychology roles in consulting - what kind of keywords should I use to search?",21
"Advice on future job interview?",0
"if you're looking for io career advice",39
"Wondering if things I have done/have lined up could gear me for an IO career?",2
"Best places to do an internship",11
"Whats your story?",21
"Is I/O Psychology Merely Glorified Human Resources?",2
"Looking to do qualitative research about organizational culture in tech startups - ideas for specific research questions within this?",1
"Project Management?",7
"Bi-Weekly /r/IOpsychology Discussion - What have you been reading, and what do you think of it?",3
"Has anyone successfully used their skills after getting a dual IO/MBA Degree?",13
"I/O Career.",7
"Interested in OD/OBM consulting - how essential is grad school?",4
"(Re-)live in-person SIOP 2022 with this funny highlights reel!",6
"Why does everyone hate The Chicago School of Professional Psychology?",28
"ADVICE NEEDED: Path to IO Psych Professor",6
"Breaking into I/O",4
"Phd IO Psych Stipend",12
"Should I take the job?",12
"Have you ever helped a friend or family member with finding a suitable career for them?",12
"Associations Between Occupational Status, Support at Work, and Salivary Cortisol Levels",12
"Need advice before opting for a masters.",10
"Remote work posts: an evidence-based reviews",23
"Non-Psych Graduate Needs Advice",2
"I know this question may sound a little dumb but what do you do everyday in the office?",25
"Are there any good online resources to learn the math/statistics part of IO Psychology?",18
"SPSS statistical data",0
"What's it like working as an IO psychologist?",2
"Are there I/O psychologists that work for the video game industry?",16
"Recent Master's Grad looking for job help",15
"Working on an article for common stats methods in our field, however topics on regression are all over the place.",4
"What are you working on? - June 2022",1
"What's the most revolutionary paper in io-psych in the last year?",30
"Bi-Weekly /r/IOpsychology Discussion - What have you been reading, and what do you think of it?",9
"Book recommendations",16
"Does something like the O*NET exist in other countries?",21
"Normative vs. Ipsative personality tests in selection",15
"Differences between IO Psychology and Software Engineering?",12
"Top tier company but shitty job position",6
"Is there research/ what is your experience with this - Perceptions of unfairness when blind selection results in non-diverse outcomes",9
"I need suggestions for the intervention of work teams in the field of organizational development",5
"What are good companies and titles that are relevant into getting a good occupation once I obtain my Bachelors in IO Psychology?",5
"Job-seekers prefer to work for more diverse companies - ""A new study finds that job seekers are even willing to explore jobs with lower salaries when companies are more diverse.""",19
"IO and Data Science/Analytics Question",14
"Using the PAI as part of selection",2
"What Excel skills are most important to know for a career in this field?",21
"What should I read to learn more about the relationship between workforce diversity and organizational performance?",11
"Looking for audio book recommendations",14
"Name vs program",9
"Can I talk to any IO psychologists? Basic questions for someone interested in learning about how life as an IO psychologist is.",11
"Resume vs. CV",1
"Clinical psych masters student looking at I/O",2
"Professor career outlook?",8
"what do your jobs consist of daily?",21
"Fall 22 PhD Admits I/O",10
"Advice for activities during a gap year",9
"Bi-Weekly /r/IOpsychology Discussion - What have you been reading, and what do you think of it?",8
"Those who got their masters outside the US",1
"Lost undergrad in need of some guidance",2
"Good Books About Team Member Archetypes?",2
"Case Interview for Consulting Jobs",9
"Talent Acquisition and Recruitment",5
"What should I do to help build my resume for IO",10
"Disappointing Job Search",23
"Is Job experience, or research experience more important for MA?",7
"Seeking advice/ opinions!",0
"Where to find conferences related to HR / Psychology / OD",4
"Would I be a good fit for IO psychology? Would I be interested?",12
"Data Analysis &amp; Insights!",6
"USA I/O PhD Salary/Stipend",6
"Is there research around optimal amounts of PTO for employees to take?",25
"Post-Grad Plans",2
"Will my GPA kill me in grad school apps?",3
"Help developing research question on AI in work",6
"Business Psych undergraduate",4
"Undergrad student looking for advice on the field",15
"Cry for help: thesis on disidentification",11
"What to read next?",2
"Tests of General Mental Ability for personnel selection that avoid bias?",3
"Research relating to game-based assessments?",17
"Being thick-skinned vis-a-vis enduring toxic culture.",5
"What should I read to learn about pay for performance?",12
"Is broad or focused experience better?",10
"Job titles/Industry",6
"Books for sharing",2
"Are performance reviews illegal for global independent contractors?",3
"Applying to NSF GRFP?",6
"What are the cornerstones of a good onboarding procedure?",8
"Got a stack of grad school textbooks Im probably never gonna use again. Whats the best way to donate them?",58
"Whats youre favorite IO topic from the movie Office Space (1999)?",36
"Question",9
"Telework satisfaction, wellbeing and performance in the digital era. Lessons learned during COVID-19 lockdown in Spain",8
"Survey wording question",5
"Question about being a Recruiter for a company such as McKinsey",11
"Baruch Executive Master in IO",6
"What tools do IO Psychologists use?",9
"Podcasts for commute",12
"SIOP COVID transmission",41
"Organizational demography",3
"SIOP after action discussion. Share the good, bad, and memorable thoughts and experiences here.",34
"Looking for information on technology-based assessments (preferably systematic reviews or meta-analysis) - any recommendations?",4
"What research/ area/ article should managers in an organization be specifically reading or following?",10
"What are you working on? - May 2022",6
"Is the Chicago School of professional psychology a bad school?",4
"Suggestions for how to keep up with IO Psychology research? - Specifically meta-analysis and systematic literature reviews",32
"I got accepted to UGAs IOMP!!!",19
"Atlanta vs Dallas for IO Jobs",6
"Is there any way for getting access to Academy of Mgmt articles (w/o paying for it?) Sci hub doesn't seem to find those articles. pls help",3
"Who's at SIOP?",7
"Any airlines that hire I/O Psychologists?",19
"Interpretable machine learning models",4
"I/Os on an island who eventually built your own team, how did you do it?",22
"Tips for breaking into people/talent analytics?",9
"The Many Forms of Toxic Leadership Article",11
"Im at a loss on what to do for my future career in psychology, can ya'll give me some ideas?",5
"Knowledge diversity and hierarchy affect team effectiveness. Diverse teams function well only under the right leadership structure.",15
"5/6 months until I start applying for Masters - what do I do?",2
"Digital nomad and IO",6
"What knowledge derived from the study of psychology is practical?",0
"Undergrad research",10
"Need a shorter assessment for employee works styles that can be used to facilitate team development",5
"People Analytics?",29
