"title","upvotes"
"How would you approach translating survey items and academic material into multiple languages? How can you ensure consistency of meaning etc?",6
"What do you regard as essential readings on change and resilience?",3
"Taking 4-5 years to do part time masters in US. Concerned about knowledge retention.",18
"Bi-Weekly /r/IOpsychology Discussion - What have you been reading, and what do you think of it?",2
"Keywords to look for when looking for an internship?",2
"Unconcious bias",4
"Any readings about the math and statistics behind classical test theory?",9
"Is there a list of tests for various traits",2
"What ethical problems have you encountered in your career?",22
"Best online master's program for I/O psychology?",2
"Where can I find sample social network analysis data sets?",3
"Elon Musk scraps Twitters work from home policy",47
"How to start my career in IO?",13
"SIOP registration transfer",13
"Hogan Certification worth it?",4
"Four-day week: major breakthrough as most UK firms in trial extend changes",22
"Bi-Weekly /r/IOpsychology Discussion - What have you been reading, and what do you think of it?",5
"Conferences?",5
"Psych-&gt;corporate",10
"Undergraduate wondering if I should transfer schools",1
"Struggling between I/O psychology and School Psychology?",1
"Systems Theory Resources",10
"Experiences from People Analytics",16
"What are the top or most prestigious I/O psych schools?",13
"Neurodivergent Selection",10
"IO Icebreaker activity",2
"Work &amp; Organisational Behaviour Research - Request for Survey Participants (Work Ability &amp; Presenteeism)",5
"Value of an education in IO psych",4
"Looking to talk with someone who does Executive Coaching for their career. I'd like to learn more about your day to day life and see if this is a good path for me to take. Thank you so much.",6
"should I go for a UX research bootcamp",2
"Professionals in Consulting, how did you start your career, where are you now, and where are your next career steps?",32
"Graduating with a Major in Psychology and Minor in Business. How should I proceed post-grad?",10
"Lab equipment - recommendations",4
"what do you do with your assessment data on leaders?",3
"SIOP Conference question: Does anyone have an extra room at the Sheraton?",3
"internships / organizations",1
"Will sales job help me get a job in industrial psychology?",0
"Best measure of social support?",5
"Crosspost: Someone asked a question about the validity of MBTI, by the time I set up this submission, it was locked and removed",13
"Power BI or Tableau?",4
"Neurodiversity within I/O",20
"Corrective plans for low performing account managers",5
"IO Psychology and CSR",9
"R users, why not python?",7
"Do you need to know about IO psych before you register to a master degree of IO PSY?",7
"First SIOP Acceptance: What to do",15
"Stats in the industry",12
"My job not only wants me to create a training which no needs analysis was done for but also wants me to just come up with a quiz for the end of it",22
"Going Insane Waiting to Hear Back About Graduate School...",2
"Bi-Weekly /r/IOpsychology Discussion - What have you been reading, and what do you think of it?",2
"How long after you received your graduate degree did you land a masters level job?",9
"Which bachelors degree would be most beneficial",6
"be honest: what exactly do you people do? =-",1
"2022 SIOP REPORT ?",5
"Research on food service industry?",1
"I/O Psych with speciality in cybersecurity?",1
"Experience with the OCAI assessment?",4
"Should I get a Design Thinking Certification?",5
"Careers similar to I-O psych that use more statistics and data science aspects",10
"Take more IO Pysch classes without being enrolled in a degree program?",3
"Engagement vs. Experience",12
"IO Discord link PLS",3
"Another week, hopefully those applying are hearing back!",9
"Employee-focused careers in I/O",7
"How to get into Consulting (Human Capital and Organizational Development)",27
"Limitations of Open Science in Field Research",4
"Suggestions on my research project.",0
"Proper pronunciation of SME",0
"How to create a relationship map?",2
"How will ChatGPT hurt our field? How will it help it?",20
"What is the best text?",12
"PhD advisor style preference?",0
"Future of continuous listening?",8
"Impact of Transactional Analysis (TA) in the workplace",2
"A guide for People Analytics?",19
"Question about questions",5
"America, we have a problem. People aren't feeling engaged with their work",21
"Design and Analysis of Experiments-10th edition",1
"is it hard for a foreigner to find i/o jobs in the us?",5
"How to assess the responses to behavioral interview questions?",14
"AI Based Assessments",10
"Measuring org wellbeing",1
"Masters in Psychology after MBA Finance",1
"Employee creativity as way to deal with crises at work: The case of covid-19",1
"What are possible jobs to work before pursuing a masters?",9
"Should I pursue I/O psychology if I wish to get a master's abroad and work in that same country abroad?",7
"Bi-Weekly /r/IOpsychology Discussion - What have you been reading, and what do you think of it?",5
"How can I learn more about developing questionnaire items?",8
"Reporting / BI Analyst Salary",4
"Transition to people analytics role but lack IO background",6
"IO Consulting firms profit and experience",6
"Class of 2023, has anyone heard back from any graduate programs yet?",8
"How are we to create any good change when this is how people feel",50
"Would I be happy as an IO psychologist?",13
"Are You Quiet Quitting? Personal Finance Expert Highlights Risks of Doing the 'Bare Minimum' at Work",0
"Education requirements",7
"Upon graduation with a masters level degree in IO, would I be doing myself a disservice applying to a small company?",10
"Vox article: ""Job interviews are a nightmare  and only getting worse""",25
"career help",5
"Aspiring I-O Psychologist!",1
"Post-Grad school options of I/O",8
"Really struggling with my SoP",5
"I really pissed off people at /r/recruiting by saying experience is not predictive of performance. Since they won't explain why, can someone here?",38
"Youre an I/O psychologist on a quest to save the world.",22
"job change",7
"Trying to write a narrative review paper but I am struggling",2
"Leadership Development Certifications",3
"Potential Internship opportunities",8
"Recent I/O Masters Grad with no experience",5
"What skills can I add to become more employable?",24
"good warm up, or refresher in the work of IO psychology",2
"Data informing workforce strategy and planning",4
"SIOP without a masters",10
"Talent review",0
"Informed Consent for Job Applicants?",2
"Thinking of pursuing my MS in I/O- advice?",12
"How to explain the purpose of an IQ test without calling it an IQ test?",9
"RMPA Presentations?",3
"I/O careers and opportunities in the sports industry?",6
"General I/OP career advice",6
"What are the books/journal articles/literature that you live by as a researcher/practitioner in I/O Psychology?",13
"IO or HRM masters?",13
"Can you make $100k without a master's? Can you become a consultant without a master's?",21
"Does rem experience transfer well/ if at all - to OD roles?",1
"The DSM of I-O Psychology",21
"Harvard Business Review",19
"Journal recommendations",3
"Is mission alignment considered job relevant?",1
"Just finished my Master's IO Psych and am looking for advice",12
"Concern over not committing to an original thesis idea",10
"Question on Hertzberg's Two Factor Theory",3
"Job analysis question for practitioners",10
"Career with chronic illness?",8
"How do you feel about McKinseys Imbellus game?",1
"What do applicants dislike about selection procedures?",7
"Gordon Ramsey inspired me to go into IO Psychology",40
"Good to see some more light shined on PA outside of the I/O space. Thoughts on this description?",23
"Bi-Weekly /r/IOpsychology Discussion - What have you been reading, and what do you think of it?",9
"Internship Advice",1
"Tools for auditing company culture?",4
"Career Path Advice",7
"Mentoring Communities",4
"Interesting New TIP Article: I-O and HR: Does HR Know About Us? (***Spoilers**** Nope)",21
"What is the research design for this?",4
"Do Internships in Different Countries Matter?",2
"Possible to break into the field (again)?",6
"What explains recent tech layoffs, and why should we be worried?",8
"Occupational stress index",5
"Why am I so unproductive at my desk but not other areas?",7
"SIOP Conference: Has anyone gotten HRCI credits approved?",1
"How to get research experience",8
"How to improve organizational culture?",5
"Is there research around the benefits/drawbacks of keeping self-evalutions but removing the quantitative component for performance reviews?",13
"Scale for Seeking Relationships at Work",3
"Question on starting/teaching an I-O course at a community college.",12
"Looking for your: Recommended Resources and Career Guidance",7
"Anyone excited to go to SIOP?",19
"Is masters in general psychology enough or is IO masters essential?",15
"I/O Career help.",6
"The psychology of layoffs",21
"Is it possible to go from a masters in I/O to Clinical psychology?",4
"Baby Boomers Are More Sensitive Than Millennials, According To The Largest-Ever Study On Narcissism -",20
"Job path",5
"Announcing the Beth E. Buchanan Graduate Student Scholarship Fund",40
"Interesting discussion of I-O Psychology field and in its tensions in 2013. How similar does this feel to you?",4
"Moral emotions in I/O Psych from an evolutionary perspective?",1
"Bi-Weekly /r/IOpsychology Discussion - What have you been reading, and what do you think of it?",2
"IO- and Neuropsychology topics",9
"Gender-biased language decoder",4
"Open Source Tableau",3
"Starting salary with a masters in I/O?",24
"Spurious correlation exercise",11
"Job board specifically for I/O Psychology",26
"Is there a list for I/O programs in California",7
"Research on drinking culture at work?",15
"Job analysis",3
"Writing sample topics",5
"AMA Tara Behrend, SIOP President-Elect, future of work researcher, professor at Purdue!",68
"Most research active organizations?",16
"How to choose an assessment for a hiring process?",7
"What are your unpopular IO Psych opinions?",58
"Help with Dissertation!",1
"I/O Podcast",26
"What to do next.",5
"How do you find companies to work for outside of job boards like LinkedIn/Indeed?",21
"IO Psychology Careers Job Security",7
"Undergrad advice!",1
"LGBTQ+ Researching Scholars",11
"Bi-Weekly /r/IOpsychology Discussion - What have you been reading, and what do you think of it?",8
"ChatGPT on how to use ChatGPT for HR",11
"Virtual SIOP Conference vs in-person",9
"Does io psych talk about why professional world words can sound extremely formal, maybe royal? for example interviews are often not done ""done"" but ""given"" or ""offered""?",7
"Ethical leadership in workplace settings can cause narcissists to become angry and withdraw: Study finds that anger is the mediator between those with narcissistic personality traits experiencing ethical leadership and their subsequent withdrawal.",22
"Looking to make a Lateral move from non-profit Child welfare education/mental health based programs as a Supervisor, into Data analytics type role",7
"could artificial intelligence replace IO psychology in the future (2-3 decades)",15
"Are SHRM or HRCI certs valued in the I/O field?",13
"What was your most memorable and/or favorite gradschool experience?",7
"Topics that Dont Have Enough Research",11
"ChatGPT on what we would be a good name for our field.",45
"Online Courses (ie. Coursera)",9
"Best practices",1
"ChatGPT has become an IO psychologist",103
"Do career interest surveys actually do anything?",4
"Announcing upcoming AMA March 15h-16-17th at noon Tara Behrend, President-Elect of SIOP, future of work expert, and professor at Purdue!",36
"How to break into the I/O field?",9
"Volunteer or gig I/O work?",8
"How to evaluate the effectiveness of an innovative idea before implementing it?",5
"IO Psychology Transition Advice Needed!!!!",5
"Research and Discussion of Perceptions on Applicant Assessment",4
"What is your professional opinion in thebusage of this question and your knowledge of this general approach to candidate screening?",8
"Conferences other than the annual SIOP conference?",6
"what are you doing for your continuous listening strategy?",7
